,hosp_num,hosp_name,full_address,addr,city_state_zip,nicu_beds,num_neonats,neonat_names,referral
462,462,MARQUETTE GENERAL HOSPITAL,"420 W. Magnetic Marquette, MI 49855",420 W. Magnetic,"Marquette, MI 49855",Level IIIB; NICU Beds: 12,Neonatologists: 3,Neonatologists names: Julia Frei; John Grandy; Charles Paxson,NA
463,463,ST. JOSEPH MERCY - OAKLAND,"44405 Woodward Ave. Pontiac, MI 48341",44405 Woodward Ave.,"Pontiac, MI 48341",Level IIIB; NICU Beds: 30,Neonatolaglsts: 3,Neonatologists names: Rajendra Desai; Amy Martin; Narasingrao Pampati,NA
464,464,CRITTENTON HOSPITAL,"1101 W. University Dr. Rochester, MI 48307-1831",1101 W. University Dr.,"Rochester, MI 48307-1831",Level IIB; NICU Beds: 8,Neonatologists: 1,Neonatologists names: Kanamarlapudi Rao,NA
465,465,WILLIAM BEAUMONT HOSPITAL,"3601 W. Thirteen Mile Rd. Royal Oak, MI 48073-6769",3601 W. Thirteen Mile Rd.,"Royal Oak, MI 48073-6769",Level IIIB; NICU Beds: 61,Neonatalogists: 10,Neonatologists names: A. Cohn; David De Witte; S. Devevarahally; Martin Espinosa; Paul Holtrop; Judith Klarr; Lisa Oca; Cynthia Pryce; Fovia Saleem-Rasheed; Barbara Steffes,NA
466,466,COVENANT HEALTHCARE,"1447 N. Harrison St. Saginaw, MI 48602",1447 N. Harrison St.,"Saginaw, MI 48602",Level IIIB; NICU Beds: 55,Neonatologists: 4,Neonatologists names: Khawar Moshini; Martin Nwankwo; Chai Soontharotoke; Serge Thurin,NA
467,467,PROVIDENCE HOSPITAL,"16001 W. Nine Mile Rd. Southfield, MI 48037",16001 W. Nine Mile Rd.,"Southfield, MI 48037",Level IIIB; NICU Beds: 15,Neonatologists: 3,Neonatologists names: Rima Dajani; Betty Go; Shahid Khan,NA
468,468,MUNSON MEDICAL CENTER,"1105 Sixth St. Traverse City, MI 49684",1105 Sixth St.,"Traverse City, MI 49684",Level IIIB; NICU Beds: 20,Neonatologists: 2,Neonatologists names: David Sliamanna; Steven St. Charles,NA
469,469,WILLIAM BEAUMONT HOSPITAL - TROY,"44201 Dequindre Rd. Troy, MI 48085",44201 Dequindre Rd.,"Troy, MI 48085",Level IIB; NICU Beds: 6,Neonatologists: 1,Neonatologists names: David Dewitte,NA
470,470,ST. MARY'S MEDICAL CENTER,"407 E. Third St. Duluth, MN 55805",407 E. Third St.,"Duluth, MN 55805",Level IIIB; NICU Beds: 25,Neonatologists: 3,Neonatologists names: Naeem Chaudhry; Lee Muskovitz; Christina Salgier,NA
471,471,CHILDREN<U+2019>S HOSPITAL & CLINIC,"2525 Chicago Ave., S. Minneapolis, MN 55404","2525 Chicago Ave., S.","Minneapolis, MN 55404",Level IIIC; NICU Beds: 44,Neonatologists: 12,Neonatologists names: Ellen Bendel-Stenzel; David Brasel; Diane Camp; Jane Darthell; Bruce Ferrara; Ronald Hoekstra; Virginia Hustead; Bonnie Landrum; Jeanne Mrozek; Neil Mulrooney; Nathaniel Payne; Nina Perdue,NA
472,472,HENNEPIN COUNTY MEDICAL CENTER,"701 Park Ave., S. Minneapolis, MN 55415","701 Park Ave., S.","Minneapolis, MN 55415",Level IIIB; NICU Beds: 23,Neonatologists: 4,Neonatologists names: Connie Adkinsson; Raul Cifuentes; Richard Lussky; Asha Siddappa,NA
473,473,UNIVERSITY OF MINNESOTA AMPLATZ CHILDREN<U+2019>S HOSPITAL,"2450 Riverside Ave. Minneapolis, MN 55454",2450 Riverside Ave.,"Minneapolis, MN 55454",Level IIIC; NICU Beds: 41,Neonatologists: 14,Neonatologists names: Indu Agarwal; Catherine Bendel; Nancy Fahim; Cheryl Gale; Thomas George; Michael Georgieff; Sixto Guiang III; Dana Johnson; Mary Pylipow; Sara Ramel; Raghu Rao; Kari Roberts; Erin Stepka; Theodore Thompson,NA
474,474,NORTH MEMORIAL MEDICAL CENTER,"3300 Oakdale Ave., N. Robbinsdale, MN 55422","3300 Oakdale Ave., N.","Robbinsdale, MN 55422",Level IIIB; NICU Beds; 35,Neonatologists:,NA,"Refer to Neonatologists Group of University of Minnesota Children's Hospital, Minneapolis, MN"
475,475,MAYO CLINIC ST. MARY'S HOSPITAL,"1216 Second Street SW Rochester, MN 55905",1216 Second Street SW,"Rochester, MN 55905",Level IIIC; NICU Beds: 30,Neonatologists: 6,Neonatologists names: Garth Asay; William Carey; Christopher Colby; Douglas Derleth; Robert Johnson; Tara Lang,NA
476,476,ST. CLOUD HOSPITAL,"1406 Sixth Ave., N. St. Cloud, MN 56303","1406 Sixth Ave., N.","St. Cloud, MN 56303",Level IIIB; NICU Beds: 20,Neonatologists: 4,Neonatologists names: Oluade Akayi; Louis Heck; Edward Martin; Tracey Thompson,NA
477,477,CHILDREN'S HOSPITAL OF MINNESOTA - PAUL,"345 N. Smith Ave. St. Paul, MN 55102",345 N. Smith Ave.,"St. Paul, MN 55102",Level IIIB; NICU Beds: 50,Neonatologists: 7,Neonatologists names: Michael Coleman; Catterine Gatto; Erik Hagen; Andrea Lampland; Mark Mammel; Thomas Pakora; Jill Therein,NA
478,478,REGIONS HOSPITAL,640 Jackson St. St. Paul. MN 55101,640 Jackson St.,St. Paul. MN 55101,Level IIB; NICU Beds: 10,Neonatologists:,NA,"Refer to Neonatologists Group of Children's Hospital of Minnesota, St. Paul, MN"
479,479,ST. MARY'S MEDICAL CENTER,"201 NW R.D, Mize Road Blue Springs, MO 64014","201 NW R.D, Mize Road","Blue Springs, MO 64014",Level IIB; NICU Beds: 10,Neonatologists:,NA,"Refer to Neonatologists Group of Children's Mercy Hospital, Kansas City, MO"
480,480,SOUTHEAST MISSOURI HOSPITAL,"1701 Lacey St. Cape Girardeau, MO 63701",1701 Lacey St.,"Cape Girardeau, MO 63701",Level IIIA; NICU Beds: 10,Neonatologists: 1,Neonatologists names: Paul Caruso,NA
481,481,ST. FRANCIS MEDICAL CENTER,"211 Saini Francis Dr. Cape Girardeau, MO 63703-8399",211 Saini Francis Dr.,"Cape Girardeau, MO 63703-8399",Level IIIB; NCU Bods: 25,Neonatologists: 3,Neonatologists names: Laura Al-Sayed; Alan Barnette; Karlyle Christian-Ritter,NA
482,482,ST. LUKE'S HOSPITAL,"232 S. Woods Mill Rd. Chesterfield, MO 60317-3480",232 S. Woods Mill Rd.,"Chesterfield, MO 60317-3480",Level IIIA; NICU Beds: 12,Neonatologists:,NA,"Refer to Neonatologists Group of St, John's Mercy Medical Center Hospital of St, Louis, MO."
483,483,BOONE HOSPITAL CENTER,"1600 E. Broadway Columbia, MO 65201",1600 E. Broadway,"Columbia, MO 65201",Level IIIB; NICU Beds: 20,Neonatologists: 2,Neonatologists names: Tim O'Connor; Laura O'Gorman,NA
484,484,CHILDREN'S HOSPITAL AT UNIVERSITY OF MISSOURI,"404 Keene St. Columbia, MO 65201-6626",404 Keene St.,"Columbia, MO 65201-6626",Level IIIB; NICU Beds: 38,Neonatotogists: 8,Neonatologists names: Daniela Bichianu; Laura Hillman; Elizabeth James; Naomi Lauriello; John Pardalos; Sarah Patton; Elizabeth Peters; Michael Sherman,NA
485,485,CENTERPOINT MEDICAL CENTER,"19600 E. 39th S. Independence, MO 64057",19600 E. 39th S.,"Independence, MO 64057",Level IIIA; NICU Beds: 12,Neonatologists:,NA,"Refer to Neonatologists Group of Overland Park Regional Medical Center, Overland Park, KS"
486,486,FREEMAN HEALTH SYSTEM,"1102 W. 32nd St. Joplin, MO 64804",1102 W. 32nd St.,"Joplin, MO 64804",Level IIIB; NICU Beds: 20,Neonatologists: 3,Neonatologists names: Eileen Deano; Levent Kahraman; Raymond Sanders,NA
487,487,CHILDREN'S MERCY HOSPITAL,"2401 Gillham Rd. Kansas City, MO 64108-9898",2401 Gillham Rd.,"Kansas City, MO 64108-9898",Level IIIC; NICU Beds: 60,Neonatologists: 22,Neonatologists names: Ikechukwu Ekekezie; Linda Gratny; Frederick Hall; Jodi Jackson; Ayman Khmour; Howard Kilbride; Charisse Lachica; Winston Manimtim; Emily McNellis; Adebayo Oshodi; Felix Okah; Okunola Oluola; Steve Olsen; Jean Pallotto; Joshua Petrikin; Gary Pettett; Danielle Reed; Jotishna Sharma; Michael Sheehan; William Truog; Kristine Voos; Julie Weiner,NA
488,488,RESEARCH MEDICAL CENTER,"2316 E. Meyer Blvd. Kansas City, MO 64132",2316 E. Meyer Blvd.,"Kansas City, MO 64132",Level IIIB; NICU Beds: 17,Neonatologists:,NA,"Refer to Neonatologists Group of Overland Park Regional Medical Center Overland Park, KS"
489,489,SAINT JOSEPH MEDICAL CENTER,"1000 Carondelet Dr. Kansas City, MO 64114",1000 Carondelet Dr.,"Kansas City, MO 64114",Level IIB; NICU Beds: 9,Neonatologists:,NA,"Refer to Necnatologists Group of Children<U+2019>s Mercy Hospital, Kansas City, MO"
490,490,ST.-LUKE'S HOSPITAL OF KANSAS CITY,"4400 Wornall Kansas City, MO 64111",4400 Wornall,"Kansas City, MO 64111",Level IIIB; NICU Beds: 48,Neonatologists: 10,Neonatologists names: John Anderson; Candace Caldwell; John Callenbach; Barbara Carr; William Chao; Katherine Claflin; Katherine Florendo; Brian Heimes; Juan Longhi; Stanley Shaffer,NA
491,491,TRUMAN MEDICAL CENTER HOSPITAL HILL,"2301 Holmes St. Kansas City, MO 64108",2301 Holmes St.,"Kansas City, MO 64108",Level IIIA; NICU Beds: 20,Neonatologists:,NA,"Refer to Neonatologists Group of Children's Mercy Hospital, Kansas City, MO"
492,492,ST. LUKE'S EAST HOSPITAL - LEE'S SUMMIT,"100 NW St. Luke's Blvd. Lee's Summit, MO 64086",100 NW St. Luke's Blvd.,"Lee's Summit, MO 64086",Level IIB; NICU Beds: 10,Neonatologists:,NA,"Refer to Neonatologisis Group of St, Luke's Hospital of Kansas City, Kansas City, MO"
493,493,NORTH KANSAS CITY HOSPITAL,"2800 Clay Edwards Dr. North Kansas City, MO 64116",2800 Clay Edwards Dr.,"North Kansas City, MO 64116",Level IIB; NICU Beds: 12,Neonatologists:,NA,"Refer to Neonatologists Group of Children<U+2019>s Mercy Hospital, Kansas City, MO"
494,494,COX HEALTH,"3801 S. National Springfield, MO 65807",3801 S. National,"Springfield, MO 65807",Level IIIB; NICU Beds: 52,Neonatologists: 4,Neonatologists names: Joseph Eccher; Sarah Kuhlman; Marie Mc Gettingan; Colleen Rose,NA
495,495,ST. JOHN'S REGIONAL HEALTH CENTER,"1235 E. Cherokee Springfield, MO 65804",1235 E. Cherokee,"Springfield, MO 65804",Level IIIB; NICU Beds: 28,Neonatologists: 4,Neonatologists names: Consolacion Sison; Melinda Slack; Edward Stevens Jr.; Viswanathan Subramanian,NA
496,496,BARNES-JEWISH HOSPITAL,"#1 Childrens Place, 84NWT St. Louis, MO 63110","#1 Childrens Place, 84NWT","St. Louis, MO 63110",Level IIA; NICU Beds: 18,Neonatologists:,NA,"Refer to Neonatolagists Group of St. Louis Children's Hospital, St. Louis, MO"
497,497,CARDINAL GLENNON CHILDREN'S HOSPITAL; ST. LOUIS UNIVERSITY,"1465 S. Grand Blvd. St. Louis, MO 63104",1465 S. Grand Blvd.,"St. Louis, MO 63104",Level IIIC; NICU Beds: 60,Neonatologists: 19,Neonatologists names: Mohamad Al-Hosni; Ayoob Ali; Connie Anderson; Thomas Bender; Gregory Booth; Robert Brookner; Laura Cerny; Catherine Cibulskis; Richard Cooke; Robert Fleming; Michael French; William Keenan; Heather Hall; Thomas Havranek; Joyce Koenig; Akihiko Noguchi; Farouk Sadiq; Kimberly Spence; Corinne Walentik,NA
498,498,ST. JOHN'S MERCY MEDICAL CENTER,"621 S. New Ballas Rd., #20146 St. Louis, MO 63144","621 S. New Ballas Rd., #20146","St. Louis, MO 63144",Level IIIB; NICU Beds: 100,Neonatologists: 9,Neonatologists names: Jay Brenner; William Chao; Gary Dreyer; Elizabeth Jung; Kenneth Klesh; Michael Maurker Jr.; Assaad Merchak; Casey Orellana; Edward Shwarz,NA
499,499,ST. LOUIS CHILDREN'S HOSPITAL,"One Children's Place St. Louis, MO 63110",One Children's Place,"St. Louis, MO 63110",Level IIIC; NICU Beds: 66,Neonatologists: 20,Neonatologists names: Sessions Cole; Jeffrey Dawson; Joan Downey; Brian Hacket; Aaron Hamvas; Michael Harris; Sherrie Hauft; Terrie Inder; Steve Liao; Anna Lijowska; Amit Mathur; Shakir Mohamed; Tasnim Najat; Rakesh Rao; Joane Rosenbaum; Scott Saunders; Bradley Thach; Akshaya Vachharajani; Jennifer Wanbach; Karen Wickline,NA
500,500,ST. MARY'S HEALTH CENTER; ST. LOUIS UNIVERSITY,"6420 Clayton Rd. St. Louis, MO 63117",6420 Clayton Rd.,"St. Louis, MO 63117",Level IIIA; NICU Beds: 32,Neonatologists:,NA,"Refer to Neonatologists Group of Cardinal Glennon Children's Hospital St. Louis University, St. Louis, MO"
501,501,RIVER OAK HOSPITAL,"1030 River Oaks Dr. Flowood, MS 39232",1030 River Oaks Dr.,"Flowood, MS 39232",Level IIIB; NICU Beds: 20,Neonatologists:,NA,"Refer to Neonatologists Group of Mississippi Baptist Medical Center, Jackson, MS"
502,502,MEMORIAL HOSPITAL AT GULFPORT,"4500 13th St. Gulfport, MS 39502-1810",4500 13th St.,"Gulfport, MS 39502-1810",Level IIIB; NICU Beds: 17,Neonatologists: 5,Neonatologists names: Randal Henderson; David Kuhlmann; Ken Schroeter; Kerry Stewart; White Clinton,NA
503,503,FORREST GENERAL HOSPITAL,"6051 Us 49 Hattiesburg, MS 39401",6051 Us 49,"Hattiesburg, MS 39401",Level IIIB; NICU Beds: 25,Neonatologists: 3,Neonatologists names: Randall Henderson; Kerry Stewart; Clint White,NA
504,504,WESLEY MEDICAL CENTER - HATTIESBURG,"5001 Hardy St. Hattiesburg, MS 39404",5001 Hardy St.,"Hattiesburg, MS 39404",Level IIIA; NICU Beds: 14,Neonatologists: 2,Neonatologists names: Alan Brinson; Rolando Volar,NA
505,505,CENTRAL MISSISSIPPI MEDICAL CENTER,"1850 Chadwick Dr. Jackson, MS 39204",1850 Chadwick Dr.,"Jackson, MS 39204",Level IIIA; NICU Beds: 22,Neonatologists:,NA,"Refer to Neonatologists Group of Mississippi Baptist Medical Center, Jackson, MS"
506,506,MISSISSIPPI BAPTIST MEDICAL CENTER,"1225 N. State St. Jackson, MS 39202",1225 N. State St.,"Jackson, MS 39202",Level IIIB; NICU Beds: 32,Neonatologists: 8,Neonatologists names: Mitzi Ferguson; Cris Glick; Daniel McCaughan; Jason Miller; Jack Owens; Kenny Robbins; David Temple; Dave Wender,NA
507,507,ST. DOMINIC - JACKSON MEMORIAL HOSPITAL,"969 Lakeland Dr. Jackson, MS 39216",969 Lakeland Dr.,"Jackson, MS 39216",Love IIIB; NICU Beds: 20,Neonatologists:,NA,"Refer to Neonatologists Group of Mississippi Baptist Medical Center, Jackson, MS"
508,508,UNIVERSITY OF MISSISSIPPI MEDICAL CENTER,"2500 N. State St. Jackson, MS 39216-4505",2500 N. State St.,"Jackson, MS 39216-4505",Level IIIC; NICU Beds: 90,Neonatologists: 8,Neonatologists names: Abhay Bhatt; Leigh Campbell; Mobolaji Famuyide; Glen Graves; Kelly Hersey; Mary Anne Kosek; Philip Rhodes; Samuyide,NA
509,509,WOMENS HOSPITAL AT RIVER OAKS,"1026 N. Flowood Dr. Jackson, MS 39232",1026 N. Flowood Dr.,"Jackson, MS 39232",Level IIIA; NICU Beds: 15,Neonatologists:,NA,"Refer to Neanatologists Group of Mississippi Baptist Medical Center, Jackson, MS"
510,510,ANDERSON REGIONAL MEDICAL CENTER,"2124 14th Street Meridian, MS 39301",2124 14th Street,"Meridian, MS 39301",Level IIIB; NICU Beds: 10,Neonatologists: 3,Neonatologists names: Robert Blubaugh; Roland Boyd; Dave Kulmann,NA
511,511,RUSH FOUNDATION HOSPITAL,"1314 19th Ave. Meridian, MS 39303",1314 19th Ave.,"Meridian, MS 39303",Level IIIA; NICU Beds: 12,Neonatologists: 2,Neonatologists names: Robert Blubaugh; Roland Boyd,NA
512,512,NORTH MISSISSIPPI MEDICAL CENTER; WOMEN'S HOSPITAL,"4566 South Eason Blvd. Tupelo, MS 38801",4566 South Eason Blvd.,"Tupelo, MS 38801",Level IIIB; NICU Beds: 34,Neonatologists: 4,Neonatologists names: Bryan Darling; John Nading; Patrick O'Mara; Dennis Wright,NA
513,513,BILLINGS CLINIC,"2800 Tenth Ave. North Billings, MT 59107",2800 Tenth Ave. North,"Billings, MT 59107",Level IIIA; NICU Beds: 13,Neonatologists: 1,Neonatologists names: Nadine Seger,NA
514,514,SAINT VINCENT HEALTHCARE,"1233 N. 30th St. Billings, MT 59107",1233 N. 30th St.,"Billings, MT 59107",Level IIIB; NICU Beds: 24,Neonatologists: 4,Neonatologists names: Kari Barrett; Jeffrey Carroll; Alison Rentz; Kathleen Stevens,NA
515,515,BENEFIS HOSPITALS,"1101 26th St., S. Great Falls, MT 59405","1101 26th St., S.","Great Falls, MT 59405",Level IIIB; NICU Beds: 25,Neonatologists: 3,Neonatologists names: Sarah Kenney; Cynthia Padilla; Phillip Riedel,NA
516,516,COMMUNITY MEDICAL CENTER,"2827 Fort Missoula Rd. Missoula, MT 59804",2827 Fort Missoula Rd.,"Missoula, MT 59804",Level IIIB; NICU Beds: 22,Neonatologists: 1,Neonatologists names: Janet Hiller,NA
517,517,MISSION HOSPITALS,"509 Biltmore Ave. Asheville, NC 28801",509 Biltmore Ave.,"Asheville, NC 28801",Level IIIB; NICU Beds: 51,Neonatologists: 5,Neonatologists names: Stanley Dalton; Paul Furigay; Sim Rentz; Eric Thingroll; Charles Yoder,NA
518,518,ALAMANCE REGIONAL MEDICAL CENTER,"1240 Huffman Mill Rd. Burlington, NC 27215",1240 Huffman Mill Rd.,"Burlington, NC 27215",Leval IIB; NICU Beds: 9,Neonatologists:,NA,"Refer to Neonatologists Group of Duke University Medical Center, Durham, NC"
519,519,WAKE MED - CARY HOSPITAL,"1900 Kildaire Farm Rd. Cary, NG 27518",1900 Kildaire Farm Rd.,"Cary, NG 27518",Level IIIA; NICU Beds: 8,Neonatologists:,NA,"Refer to Neonatologists Group of Wake Medic Center, Raleigh, NC"
520,520,UNIVERSITY OF NORTH CAROLINA HOSPITALS,"4018 UNC Hospitals CB #7596 Chapel Hill, NC 27599-7596",4018 UNC Hospitals CB #7596,"Chapel Hill, NC 27599-7596",Level IIIC; NICU Beds: 46,Neonatologists: 9,Neonatologists names: Sofia Aliaga; Carl Bose; Cyril Engmann; Matthew Laughton; Diane Marshall; Martin McCaffrey; Wayne Price; Alan Stiles; Karen Wood,NA
521,521,CAROLINAS MEDICAL CENTER - PINEVILI HOSPITAL,"10628 Park Rd. Charlotte, NC 28210",10628 Park Rd.,"Charlotte, NC 28210",Level IIIA; NICU Beds: 10,Neonatologists: 2,Neonatologists names: Art Payne; Carmen Villaveces,NA
522,522,CAROLINAS MEDICAL CENTER - UNIVERSITY HOSPITAL,"1000 Blythe Blvd. Charlotte, NC 28232-2867",1000 Blythe Blvd.,"Charlotte, NC 28232-2867",Level IIIC; NICU Beds: 86,Neonatologists: 14,Neonatologists names: Michelle Chiu; Saiad Efkekhari; Paul Engstrom; David Fisher; Andrew Herman; Docia Hickey; Tom Kueser; Karen Lessaris; Timothy Mitchell; Patricia Neal; Art Payne; Maryann Rathburn; Vijay Reddy; Carmen Villaveces,NA
523,523,PRESBYTERIAN HEMBY CHILDREN'S HOSPITAL,"200 Hawthorne Lane Charlotte, NC 28233-3549",200 Hawthorne Lane,"Charlotte, NC 28233-3549",Level IIIB; NICU Beds: 45,Neonatologists: 7,Neonatologists names: Joseph Brady; David Greengerg; Rogers Howell II; Nathan Jesse; Jay Kothadia; Tania Morales; Ganapaathy Rama,NA
524,524,CAROLINA MEDICAL CENTER NORTHEAST MEDICAL CENTER,"920 Church St. North Concord, NC 28025",920 Church St. North,"Concord, NC 28025",Level IIIB; NICU Beds: 20,Neonatologists: 4,Neonatologists names: Allen Cherer; Hima Maramreddy; Matthew Saxonhouse; Robert Silver,NA
525,525,DUKE UNIVERSITY MEDICAL CENTER,"2301 Erwin Rd. Durham, NC 27710",2301 Erwin Rd.,"Durham, NC 27710",Level IIIC; NICU Beds: 65,Neonatologists: 14,Neonatologists names: Richard Auten; Margarita Bidegain; Michael Cotten; Jeffrey Ferranti; Ronald Goldberg; Ricki Goldstein; Susan Izatt; Atavali Kamlish; Robert Lenfestey; Hugo Navarro; Phillip Smith; David Tanaka; Yu Linn Tang; James Wynn,NA
526,526,DURHAM REGIONAL HOSPITAL,"3643 N. Roxboro Rd. Durham, NC 27704-2763",3643 N. Roxboro Rd.,"Durham, NC 27704-2763",Level IIIA; NICU Beds: 18,Neonatologists:,NA,"Refer to Neonatologists Group of Duke University Medical Center, Durham, NC"
527,527,CAPE FEAR VALLEY MEDICAL CENTER,"1638 Owen Dr. Fayetteville, NC 28302-2000",1638 Owen Dr.,"Fayetteville, NC 28302-2000",Level IIIB; NICU Beds: 44,Neonatologists: 4,Neonatologists names: Scott Cameron; Jan Carter; Thomas Cisnek; Keith Gallaher,NA
528,528,WOMAC ARMY MEDICAL CENTER,"2817 Reilly Rd., Bldg. 4 Ft. Bragg, NC 28310","2817 Reilly Rd., Bldg. 4","Ft. Bragg, NC 28310",Level IIIA; NICU Beds: 12,Neonatologists: 2,Neonatologists names: Andrew Grein; Eric Horowitz,NA
529,529,GASTON MEMORIAL HOSPITAL,"2525 Court Dr. Gastonia, NC 28053",2525 Court Dr.,"Gastonia, NC 28053",Level IIIA; NICU Beds: 16,Neonatologists: 2,Neonatologists names: Kevin Coppage; Ronald Holtzman,NA
530,530,WOMEN'S HOSPITAL OF GREENSBORO,"801 Green Valley Rd. Greensboro, NC 27408-7097",801 Green Valley Rd.,"Greensboro, NC 27408-7097",Level IIIB; NICU Beds: 36,Neonatologists: 6,Neonatologists names: Rita Carlos; Christie Davanzo; Mary Ann Dimaguila; Laurence Ransom; Mc Crae Smith; John Wimmer Jr.,NA
531,531,PITT COUNTY MEMORIAL HOSPITAL,"600 Moye Blvd. Greenville, NC 27834",600 Moye Blvd.,"Greenville, NC 27834",Level IIIB; NICU Beds: 70,Neonatologists: 7,Neonatologists names: Sharon Buckwald; James Cummings; Stephen Engelke; Scott Macgilvray; William Meetze; Martha Naylor; Laura Raynor,NA
532,532,CATAWBA VALLEY MEDICAL CENTER,"810 Fairgrove Church Rd., SE Hickory, NC 28602","810 Fairgrove Church Rd., SE","Hickory, NC 28602",Level IIIB; NICU Beds: 12,Neonatologists: 2,Neonatologists names: David Berry; Samuel Wellman,NA
533,533,FRYE REGIONAL MEDICAL CENTER,"420 N. Center St. Hickory, NC 28601",420 N. Center St.,"Hickory, NC 28601",Level IIIB; NICU Beds: 12,Neonatologists: 2,Neonatologists names: David Berry; Samuel Wellman,NA
534,534,ONSLOW MEMORIAL HOSPITAL,"317 Western Blvd. Jacksonville, NC 28541",317 Western Blvd.,"Jacksonville, NC 28541",Level IIIA; NICU Beds: 15,Neonatologists: 1,Neonatologists names: Madhur Mittal,NA
535,535,LAKE NORMAN REGIONAL MEDICAL CENTER,"171 Fairview Rd. Mooresville, NC 28117",171 Fairview Rd.,"Mooresville, NC 28117",Level IIB; NICU Beds: 8,Neonatologists: 2,Neonatologists names: Kevin Addison; Laura Reniker,NA
536,536,GRACE HOSPITAL,"2201 S. Sterling St. Morgantown, NC 28655",2201 S. Sterling St.,"Morgantown, NC 28655",Level IIB; NICU Beds: 4,Neonatologists: 2,Neonatologists names: James Pascale; Samuel Willinger,NA
537,537,FIRSTHEALTH MOORE REGIONAL HOSPITAL,"155 Memorial Dr. Pinehurst, NC 28374",155 Memorial Dr.,"Pinehurst, NC 28374",Level IIIA; NICU Beds: 16,Neonatologists: 2,Neonatologists names: Nicholas Lynn; Wlodzimierz Wisiniewski,NA
538,538,REX HOSPITAL,"4420 Lake Boone Trail Raleigh, NC 27607",4420 Lake Boone Trail,"Raleigh, NC 27607",Level IIIA; NICU Beds: 15,Neonatologists:,NA,"Refer to Neonatologists Group of Wake Medical Center, Raleigh, NC"
539,539,WAKE MEDICAL CENTER,"3000 New Bern Ave. Raleigh, NC 27610",3000 New Bern Ave.,"Raleigh, NC 27610",Level IIIB; NICU Beds: 36,Neonatologists: 9,Neonatologists names: Tara Bastek; Laurie Dunn; Stephen Kicklighter; Steven Parsons; James Perciaccante; Anthony Tackman; Ross Vaughan; Michele Snyder; Thomas Young,NA
540,540,NEW HANOVER REGIONAL MEDICAL CENTER; COASTAL AREA HEALTH EDUCATION CENTER,2131 South 17th St. Wilmington; NC 28402-9000,2131 South 17th St.,Wilmington; NC 28402-9000,Level IIIB; NICU Beds: 45,Neonatologists: 5,Neonatologists names: Sheri Carroll; Wells Logan; Christina Javier; Fernando Moya; Walaa Sharaf,NA
541,541,FORSYTH MEDICAL CENTER,"3333 Silas Creek Pky. Winston-Salem, NC 27103",3333 Silas Creek Pky.,"Winston-Salem, NC 27103",Level IIIB; NICU Beds: 60,Neonatologists:,NA,Refer to Neonatologists Group of Brenner Children's Hospital
542,542,WAKE FOREST UNIVERSITY BAPTIST MEDICAL CENTER,"Medical Center Blvd. Winston-Salem, NC 27157",Medical Center Blvd.,"Winston-Salem, NC 27157",Level IIIC; NICU Beds: 47,Neonatologists: 10,Neonatologists names: Modupeola Akinola; Steven Block; Heather Furlong; Jennifer Helderman; Michael O'Shea; Peter Porcelli; Beatrice Stefanesru; Lisa Washburn; Cherrie Welch; Quing Yang,NA
543,543,MEDCENTER ONE,"300 N. 7th St. Bismarck, ND 58501",300 N. 7th St.,"Bismarck, ND 58501",Level IIIB; NICU Beds: 12,Neonatologists: 1,Neonatologists names: Rafael Ocejo,NA
544,544,ST. ALEXIUS MEDICAL CENTER,"900 E. Broadway Bismarck, ND 58501",900 E. Broadway,"Bismarck, ND 58501",Level IIIB; NICU Beds: 24,Neonatologists: 3,Neonatologists names: Karen Brown; Patricia Fernancez; Mahesh Patel,NA
545,545,INNOVIS HEALTH,"3000 32nd Ave., South Fargo, ND 58103","3000 32nd Ave., South","Fargo, ND 58103",Level IIIB; NICU Beds: 10,Neonatologists: 2,Neonatologists names: Scott Mutchler; Ohananjay Deoskar,NA
546,546,SANFORD CHILOREN'S HOSPITAL FARGO,"801 Broadway North Fargo, ND 58122",801 Broadway North,"Fargo, ND 58122",Levot IIIB; NICU Beds: 33,Neonatologists: 6,Neonatologists names: Waseem Altaf; William Bellas; Mohamed Mohamed; Stephen Nelson; Janice Nicklay-Catalan; Jo-Aan Smith,NA
547,547,ALTRU HEALTH SYSTEM,"1200 S. Columbia Rd. Grand Forks, ND 58201",1200 S. Columbia Rd.,"Grand Forks, ND 58201",Level IIIB; NICU Beds: 20,Neonatologists: 3,Neonatologists names: Panda Durga; Kiran Dwarakanath; Pramod Malapatti,NA
548,548,TRINITY MEDICAL CENTER,"1 Burdick Expy. W. Minot, ND 58702-5020",1 Burdick Expy. W.,"Minot, ND 58702-5020",Level IIIB; NICU Beds: 10,Neonatologists: 2,Neonatologists names: Thomas Carver; Linda Zak,NA
549,549,BRYAN LGH MEDICAL CENTER,"1600 South 48th St. Lincoln, NE 68506",1600 South 48th St.,"Lincoln, NE 68506",Level IIIB; NICU Beds: 25,Neonatologists: 3,Neonatologists names: Larry Brausch; Mark Brisso; Albert Owusu-Ansah,NA
550,550,ST. ELIZABETH HOSPITAL,"555 S. 70th St. Lincoln, NI 68510",555 S. 70th St.,"Lincoln, NI 68510",Level IIIB; NICU Beds: 27,Neonatologists: 3,Neonatologists names: Bobbi Hawk; Rose Tan; Bernard Wilson,NA
551,551,BERGEN MERCY MEDICAL CENTER,"7500 Mercy Medical Center Omaha, NE 68124",7500 Mercy Medical Center,"Omaha, NE 68124",Level IIIA; NICU Beds: 24,Neonatologists: 6,Neonatologists names: Ann Anderson-Berry; David Bolam; Garth Fletcher; Harold Kaftan; John Schmidt; Terence Zach,NA
552,552,CHILDREN'S HOSPITAL AND MEDICAL CENTER,"8200 Dodge St. Omaha, NE 68114",8200 Dodge St.,"Omaha, NE 68114",Level IIIC; NICU Beds: 54,Neonatologists: 5,Neonatologists names: John Grebe; Bonnie Lees; Howard Needelman; John Sparks; Lynne Willett,NA
553,553,CREIGHTON UNIVERSITY MEDICAL CENTER,"601 N. 30th St. Omaha, NE 68131",601 N. 30th St.,"Omaha, NE 68131",Level IIIB; NICU Beds: 21,Neonatologists:,NA,"Refer to Neonatologists Group of Nebraska Medical Center, Omaha, NE"
554,554,METHODIST WOMEN'S HOSPITAL,"707 N. 190th Plaza Omaha, NE 68022",707 N. 190th Plaza,"Omaha, NE 68022",Level IIIB; NICU Beds: 36,Neonatologists: 6,Neonatologists names: Khalid Awad; John Jirka; Brady Kerr; David Minderman; Lynn O'Hanlon; Thomas Seidel,NA
555,555,THE NEBRASKA MEDICAL CENTER,"981205 Nebraska Medical Center Omaha, NE 68198",981205 Nebraska Medical Center,"Omaha, NE 68198",Level IIIC; NICU Beds: 36,Neonatologists: 6,Neonatologists names: Ann Anderson Berry; David Bolam; Garth Fletcher; Harold Kaftan; John Schmidt; Terence Zach,NA
556,556,DARTMOUTH-HITCHCOCK MEDICAL CENTER/CHILDREN'S HOSPITAL AT DARTMOUTH,"One Medical Center Dr. Lebanon, NH 03756-0001",One Medical Center Dr.,"Lebanon, NH 03756-0001",Level IIIB; NICU Beds: 31,Neonatologists: 6,Neonatologists names: Robert Darnall; William Edwards; George Little; Juliette Madan; Torunn Rhodes; Gautham Suresh,NA
557,557,ELLIOT HOSPITAL,"One Elliot Way Manchester, NH 03103",One Elliot Way,"Manchester, NH 03103",Level IIIB; NICU Beds: 25,Neonatologists: 4,Neonatologists names: Ernest Beale; Margaret Bulanowaski; Deborah Franzek; Kara Murphy,NA
